{
  "$id": "coach_knowledge_registry.schema.v3",
  "$schema": "https://json-schema.org/draft/2020-12/schema",
  "title": "Aiming Cookie Coach Knowledge Registry v3",
  "type": "object",
  "required": ["schema_version", "registry_version", "signal_aliases", "sources", "entries"],
  "additionalProperties": false,
  "properties": {
    "schema_version": {"const": "coach_knowledge_registry.v3"},
    "registry_version": {"allOf": [{"$ref": "#/$defs/safeString"}, {"minLength": 1, "maxLength": 80}]},
    "signal_aliases": {"type": "object", "maxProperties": 128, "propertyNames": {"$ref": "#/$defs/token"}, "additionalProperties": {"$ref": "#/$defs/token"}},
    "sources": {"type": "array", "minItems": 1, "maxItems": 512, "uniqueItems": true, "items": {"$ref": "#/$defs/source"}},
    "entries": {"type": "array", "minItems": 1, "maxItems": 512, "items": {"$ref": "#/$defs/entry"}}
  },
  "$defs": {
    "safeString": {
      "type": "string",
      "allOf": [
        {"pattern": "\\S"},
        {"pattern": "^(?!/|\\\\|~/|\\.\\.[/\\\\]|[A-Za-z]:[/\\\\]|[Ff][Ii][Ll][Ee]://)"},
        {"pattern": "^(?![\\s\\S]*(?:(?:[Aa][Pp][Ii][_-]?[Kk][Ee][Yy]|[Aa][Cc][Cc][Ee][Ss][Ss][_-]?[Tt][Oo][Kk][Ee][Nn]|[Rr][Ee][Ff][Rr][Ee][Ss][Hh][_-]?[Tt][Oo][Kk][Ee][Nn]|[Cc][Ll][Ii][Ee][Nn][Tt][_-]?[Ss][Ee][Cc][Rr][Ee][Tt]|[Pp][Aa][Ss][Ss][Ww][Oo][Rr][Dd])\\s*[:=]|\\b[Bb][Ee][Aa][Rr][Ee][Rr]\\s+\\S+|\\b[Ss][Kk]-[A-Za-z0-9_-]{8,}))"}
      ]
    },
    "token": {"allOf": [{"$ref": "#/$defs/safeString"}, {"minLength": 1, "maxLength": 160, "pattern": "^[A-Za-z0-9][A-Za-z0-9._:/ -]{0,159}$"}]},
    "text": {"allOf": [{"$ref": "#/$defs/safeString"}, {"minLength": 1, "maxLength": 1200}]},
    "listText": {"allOf": [{"$ref": "#/$defs/safeString"}, {"minLength": 1, "maxLength": 500}]},
    "source": {
      "type": "object",
      "required": ["source_ref", "source_level", "title", "author_or_org", "retrieved_at", "locator", "applicability", "supports_sections"],
      "additionalProperties": false,
      "properties": {
        "source_ref": {"$ref": "#/$defs/token"},
        "source_level": {"enum": ["product_contract", "academic_peer_reviewed", "community_organization", "coach_first_party", "community_consensus", "personal_experience_unverified", "experimental"]},
        "title": {"$ref": "#/$defs/text"},
        "author_or_org": {"$ref": "#/$defs/text"},
        "published_at": {"oneOf": [{"type": "null"}, {"allOf": [{"$ref": "#/$defs/safeString"}, {"maxLength": 32}]}]},
        "retrieved_at": {"type": "string", "pattern": "^[0-9]{4}-[0-9]{2}-[0-9]{2}$"},
        "locator": {"$ref": "#/$defs/text"},
        "applicability": {"type": "array", "minItems": 1, "maxItems": 64, "uniqueItems": true, "items": {"$ref": "#/$defs/token"}},
        "supports_sections": {"type": "array", "minItems": 1, "maxItems": 64, "uniqueItems": true, "items": {"$ref": "#/$defs/token"}}
      }
    },
    "section": {
      "type": "object",
      "required": ["section_ref", "claim_level", "source_refs", "text"],
      "additionalProperties": false,
      "properties": {
        "section_ref": {"$ref": "#/$defs/token"},
        "claim_level": {"enum": ["deterministic_rule", "research_supported", "community_practice", "community_consensus", "experimental"]},
        "source_refs": {"type": "array", "minItems": 1, "maxItems": 64, "uniqueItems": true, "items": {"$ref": "#/$defs/token"}},
        "text": {"$ref": "#/$defs/text"}
      }
    },
    "scenarioPrescription": {
      "type": "object",
      "required": ["scenario_profile_ref", "practice_condition", "review_after", "source_refs", "claim_level"],
      "additionalProperties": false,
      "properties": {
        "scenario_profile_ref": {"type": "string", "minLength": 1, "maxLength": 200, "pattern": "^scenario:[A-Za-z0-9._:@-]+$"},
        "practice_condition": {"allOf": [{"$ref": "#/$defs/safeString"}, {"minLength": 1, "maxLength": 500, "pattern": "^[^\\u0000-\\u001F]+$"}]},
        "review_after": {"enum": ["next comparable practice session", "next matched retest", "after one comparable practice block"]},
        "source_refs": {"type": "array", "minItems": 1, "maxItems": 64, "uniqueItems": true, "items": {"$ref": "#/$defs/token"}},
        "claim_level": {"enum": ["deterministic_rule", "research_supported", "community_practice", "community_consensus", "experimental"]}
      }
    },
    "entry": {
      "type": "object",
      "required": ["entry_id", "entry_version", "status", "category", "topics", "signals", "metric_refs", "family_scope", "observation_refs", "quality_prerequisites", "definition", "scope", "expected_direction", "mechanisms", "alternative_explanations", "forbidden_inferences", "limitations", "counterevidence", "sources", "supported_uses"],
      "additionalProperties": false,
      "properties": {
        "entry_id": {"type": "string", "minLength": 3, "maxLength": 160, "pattern": "^[a-z][a-z0-9]*(?:[._-][a-z0-9]+)+$"},
        "entry_version": {"type": "integer", "minimum": 1},
        "status": {"enum": ["active", "retired"]},
        "category": {"enum": ["observation_definition", "mechanism", "training_cue", "prescription_verification", "limitation", "outcome_only"]},
        "topics": {"type": "array", "minItems": 1, "maxItems": 64, "uniqueItems": true, "items": {"$ref": "#/$defs/token"}},
        "signals": {"type": "array", "maxItems": 64, "uniqueItems": true, "items": {"$ref": "#/$defs/token"}},
        "metric_refs": {"type": "array", "maxItems": 64, "uniqueItems": true, "items": {"$ref": "#/$defs/token"}},
        "family_scope": {"type": "array", "minItems": 1, "maxItems": 8, "uniqueItems": true, "items": {"enum": ["static_clicking", "dynamic_clicking", "predictable_tracking", "reactive_tracking", "control_tracking", "target_switching", "movement_aiming"]}},
        "reading_scope": {"type": "array", "minItems": 1, "maxItems": 4, "uniqueItems": true, "items": {"enum": ["speed_throughput", "precision_terminal", "dynamic_clicking", "continuous_tracking"]}},
        "observation_refs": {"type": "array", "maxItems": 64, "uniqueItems": true, "items": {"$ref": "#/$defs/token"}},
        "quality_prerequisites": {"type": "array", "maxItems": 64, "uniqueItems": true, "items": {"$ref": "#/$defs/token"}},
        "definition": {"$ref": "#/$defs/section"},
        "scope": {"$ref": "#/$defs/section"},
        "expected_direction": {"allOf": [{"$ref": "#/$defs/section"}, {"properties": {"text": {"enum": ["lower_better", "higher_better", "target_band", "descriptive_only", "comparison_only"]}}}]},
        "mechanisms": {"type": "array", "minItems": 1, "maxItems": 64, "items": {"$ref": "#/$defs/section"}},
        "alternative_explanations": {"type": "array", "minItems": 1, "maxItems": 64, "uniqueItems": true, "items": {"$ref": "#/$defs/listText"}},
        "forbidden_inferences": {"type": "array", "minItems": 1, "maxItems": 64, "uniqueItems": true, "items": {"$ref": "#/$defs/listText"}},
        "limitations": {"type": "array", "minItems": 1, "maxItems": 64, "uniqueItems": true, "items": {"$ref": "#/$defs/listText"}},
        "counterevidence": {"type": "array", "minItems": 1, "maxItems": 64, "uniqueItems": true, "items": {"$ref": "#/$defs/listText"}},
        "cue": {"$ref": "#/$defs/section"},
        "dose_guardrail": {"type": "array", "minItems": 1, "maxItems": 64, "items": {"$ref": "#/$defs/section"}},
        "matched_retest": {"$ref": "#/$defs/section"},
        "near_transfer_retest": {"$ref": "#/$defs/section"},
        "stop_adjust_rule": {"type": "array", "minItems": 1, "maxItems": 64, "items": {"$ref": "#/$defs/section"}},
        "scenario_prescription": {"$ref": "#/$defs/scenarioPrescription"},
        "sources": {"type": "array", "minItems": 1, "maxItems": 64, "uniqueItems": true, "items": {"$ref": "#/$defs/token"}},
        "supported_uses": {
          "oneOf": [
            {"const": ["explanation_only"]},
            {"const": ["explanation_only", "diagnosis_support"]},
            {"const": ["explanation_only", "diagnosis_support", "candidate_experiment"]},
            {"const": ["explanation_only", "diagnosis_support", "candidate_experiment", "scenario_prescription"]}
          ]
        }
      },
      "allOf": [
        {
          "if": {"properties": {"supported_uses": {"oneOf": [{"const": ["explanation_only"]}, {"const": ["explanation_only", "diagnosis_support"]}]}}},
          "then": {"not": {"anyOf": [{"required": ["cue"]}, {"required": ["dose_guardrail"]}, {"required": ["matched_retest"]}, {"required": ["near_transfer_retest"]}, {"required": ["stop_adjust_rule"]}, {"required": ["scenario_prescription"]}]}}
        },
        {
          "if": {"properties": {"supported_uses": {"const": ["explanation_only", "diagnosis_support", "candidate_experiment"]}}},
          "then": {
            "required": ["cue", "dose_guardrail", "matched_retest", "stop_adjust_rule"],
            "not": {"anyOf": [{"required": ["near_transfer_retest"]}, {"required": ["scenario_prescription"]}]}
          }
        },
        {
          "if": {"properties": {"supported_uses": {"const": ["explanation_only", "diagnosis_support", "candidate_experiment", "scenario_prescription"]}}},
          "then": {"required": ["cue", "dose_guardrail", "matched_retest", "near_transfer_retest", "stop_adjust_rule", "scenario_prescription"]}
        },
        {
          "if": {"properties": {"supported_uses": {"contains": {"const": "diagnosis_support"}}}},
          "then": {"properties": {"observation_refs": {"minItems": 1}, "quality_prerequisites": {"minItems": 1}}}
        }
      ]
    }
  }
}
